{
  "decision_rows": [
    {
      "confidence_score": 0.535,
      "controls_sufficient": true,
      "cost_incurred": 0.0,
      "decision_id": "dll_replay_AI_AUTH_MIDDLEWARE_PR_1788272742369",
      "environment": "github_pull_request",
      "execution_status": "blocked",
      "final_posture": "ESCALATE",
      "head_record_hash": "a89b7132c6016766b5740199c1f5587375745ce65d3c514fbbeb428d1e7fa357",
      "initial_posture": "ESCALATE",
      "interaction": "accepted",
      "judged_correct": true,
      "learning_recommendations": {
        "activation_status": "requires_review",
        "confidence_calibration_changes": [
          "Do not calibrate from this synthetic demo; collect customer-context PR records."
        ],
        "recommended_policy_updates": [
          "In a customer pilot, compare PR Guardian posture against reviewer agreement before enforcement."
        ],
        "suggested_rule_modifications": [
          "Retain certificate digest 73b988bf0ad0876faad3db9da52db34ca5ea3bd03ff37b6ae9568bec96c2cb55 with workflow artifacts."
        ]
      },
      "missing_evidence": [
        "customer_reviewer_label",
        "live_execution_outcome"
      ],
      "near_miss": true,
      "override_harmful": false,
      "override_helpful": false,
      "reason_codes": [
        "EXTERNAL_SIDE_EFFECT",
        "SENSITIVE_DATA_ACCESS",
        "HIGH_HARM_POTENTIAL"
      ],
      "recommended_safeguards": [
        "route_to_human_review",
        "preserve_replay",
        "require_explicit_approval"
      ],
      "recovery_failure": false,
      "requested_operation": "AI coding agent proposes changing authentication middleware and deployment configuration in a pull request.",
      "risk_profile": "ai_assisted_code_change",
      "rollback_performed": false,
      "rollback_success": null,
      "tenant_id": "pr-guardian-demo",
      "time_to_recover_minutes": 0.0,
      "unexpected_consequences": false
    }
  ],
  "evidence_boundary": [
    "DLL Intelligence summarizes supplied lifecycle records; it does not prove incident reduction by itself.",
    "Synthetic or analyst-assigned ledgers must be labeled before external use.",
    "Policy and calibration recommendations require human review before activation."
  ],
  "generated_at": "2026-09-01T14:25:42+00:00",
  "governance_drift_signals": [
    "multiple_missing_evidence_items_per_decision_on_average"
  ],
  "near_miss_decisions": [
    {
      "decision_id": "dll_replay_AI_AUTH_MIDDLEWARE_PR_1788272742369",
      "final_posture": "ESCALATE",
      "operation": "AI coding agent proposes changing authentication middleware and deployment configuration in a pull request.",
      "reason_codes": [
        "EXTERNAL_SIDE_EFFECT",
        "SENSITIVE_DATA_ACCESS",
        "HIGH_HARM_POTENTIAL"
      ]
    }
  ],
  "policy_review_queue": [
    {
      "activation_status": "requires_review",
      "recommendation": "In a customer pilot, compare PR Guardian posture against reviewer agreement before enforcement.",
      "recommendation_type": "policy_update",
      "source_decision_id": "dll_replay_AI_AUTH_MIDDLEWARE_PR_1788272742369"
    },
    {
      "activation_status": "requires_review",
      "recommendation": "Retain certificate digest 73b988bf0ad0876faad3db9da52db34ca5ea3bd03ff37b6ae9568bec96c2cb55 with workflow artifacts.",
      "recommendation_type": "rule_modification",
      "source_decision_id": "dll_replay_AI_AUTH_MIDDLEWARE_PR_1788272742369"
    }
  ],
  "recommended_next_action": "Collect at least 30 customer-context DLL records before presenting rates as pilot evidence.",
  "recovery_failure_decisions": [],
  "summary": {
    "controls_sufficient_count": 1,
    "controls_sufficient_rate": 1.0,
    "executed_count": 1,
    "final_posture_counts": {
      "ESCALATE": 1
    },
    "human_reviewed_count": 1,
    "initial_posture_counts": {
      "ESCALATE": 1
    },
    "judged_correct_count": 1,
    "judged_correct_rate": 1.0,
    "ledger_count": 1,
    "near_miss_count": 1,
    "outcome_reviewed_count": 1,
    "override_count": 0,
    "override_harmful_count": 0,
    "override_helpful_count": 0,
    "override_rate": 0.0,
    "recovery_failure_count": 0,
    "rollback_performed_count": 0,
    "rollback_success_count": 0,
    "rollback_success_rate": null,
    "unexpected_consequence_count": 0,
    "unexpected_consequence_rate": 0.0
  },
  "top_missing_evidence": {
    "customer_reviewer_label": 1,
    "live_execution_outcome": 1
  },
  "top_reason_codes": {
    "EXTERNAL_SIDE_EFFECT": 1,
    "HIGH_HARM_POTENTIAL": 1,
    "SENSITIVE_DATA_ACCESS": 1
  },
  "top_safeguards": {
    "preserve_replay": 1,
    "require_explicit_approval": 1,
    "route_to_human_review": 1
  },
  "version": "smerc.dll-intelligence.v1"
}
